### DISCUSSION TITLE
I may have discovered traffic interruptions during testing. Do you have any suggestions for troubleshooting?

### DISCUSSION THREAD

**Discussion by Orvaxis** [narrowlink/ipstack#67] [Q&A]
I'm migrating my project's networking layer from `smoltcp` to `ipstack` because its API is a better fit for my application's design.

I am currently testing my implementation, which is based on the examples/tun code. However, I've run into an intermittent issue. During large data transfers, the connection sometimes stalls; the speed will suddenly drop to 0 KB/s and never recover. This doesn't happen on every run and may take several attempts to reproduce.

I am quite new to low-level TCP/IP stack development, so I'm not entirely sure how to best debug this. Using Wireshark to analyze the traffic, what specific packets should I look for that might point to the root cause? For example:

Packets indicating TCP Zero Window issues?

A high number of TCP Retransmissions before the stall?

Any advice on what to focus on in the packet capture would be greatly appreciated.

```
iperf3-darwin -c 10.3.0.1 -R
Connecting to host 10.3.0.1, port 5201
Reverse mode, remote host 10.3.0.1 is sending
[  5] local 10.3.0.33 port 49373 connected to 10.3.0.1 port 5201
[ ID] Interval           Transfer     Bitrate         Rwnd
[  5]   0.00-1.00   sec   606 MBytes  5.09 Gbits/sec  64.0 KBytes                  
[  5]   1.00-2.00   sec   155 MBytes  1.30 Gbits/sec  64.0 KBytes                  
[  5]   2.00-3.00   sec  0.00 Byte s  0.00 bits/sec  64.0 KBytes                  
[  5]   3.00-4.01   sec  0.00 Byte s  0.00 bits/sec  64.0 KBytes                  
[  5]   4.01-5.00   sec  0.00 Byte s  0.00 bits/sec  64.0 KBytes                  
[  5]   5.00-6.00   sec  0.00 Byte s  0.00 bits/sec  64.0 KBytes                  
[  5]   6.00-7.00   sec  0.00 Byte s  0.00 bits/sec  64.0 KBytes                  
[  5]   7.00-8.00   sec  0.00 Byte s  0.00 bits/sec  64.0 KBytes                  
[  5]   8.00-9.01   sec  0.00 Byte s  0.00 bits/sec  64.0 KBytes                  
[  5]   9.01-10.00  sec  0.00 Byte s  0.00 bits/sec  64.0 KBytes                  
- - - - - - - - - - - - - - - - - - - - - - - - -
[ ID] Interval           Transfer     Bitrate         Retr
[  5]   0.00-10.01  sec   767 MBytes   643 Mbits/sec    0             sender
[  5]   0.00-10.00  sec   761 MBytes   638 Mbits/sec                  receiver

iperf Done.
```

**Comment by SajjadPourali** [comment]
It is hard to investigate without the `pcap` file. The chance of packet loss and retransmission is relatively lower than that of a TCP zero window. Based on what I see, I suspect a packet zero error.

This is the result from my machine; however, it is relatively slower.


```
iperf3-darwin -c 10.0.0.1 -R                                                                                                                                              25-10-08
Connecting to host 10.0.0.1, port 5201
Reverse mode, remote host 10.0.0.1 is sending
[  5] local 10.0.0.33 port 62713 connected to 10.0.0.1 port 5201
[ ID] Interval           Transfer     Bitrate         Rwnd
[  5]   0.00-1.00   sec   437 MBytes  3.67 Gbits/sec  64.0 KBytes
[  5]   1.00-2.00   sec   448 MBytes  3.76 Gbits/sec  64.0 KBytes
[  5]   2.00-3.00   sec   450 MBytes  3.77 Gbits/sec  64.0 KBytes
[  5]   3.00-4.00   sec   450 MBytes  3.78 Gbits/sec  64.0 KBytes
[  5]   4.00-5.00   sec   451 MBytes  3.78 Gbits/sec  64.0 KBytes
[  5]   5.00-6.00   sec   451 MBytes  3.79 Gbits/sec  64.0 KBytes
[  5]   6.00-7.00   sec   446 MBytes  3.74 Gbits/sec  64.0 KBytes
[  5]   7.00-8.00   sec   453 MBytes  3.80 Gbits/sec  64.0 KBytes
[  5]   8.00-9.00   sec   444 MBytes  3.72 Gbits/sec  64.0 KBytes
[  5]   9.00-10.00  sec   423 MBytes  3.55 Gbits/sec  64.0 KBytes
- - - - - - - - - - - - - - - - - - - - - - - - -
[ ID] Interval           Transfer     Bitrate         Retr
[  5]   0.00-10.00  sec  4.35 GBytes  3.74 Gbits/sec    0             sender
[  5]   0.00-10.00  sec  4.35 GBytes  3.74 Gbits/sec                  receiver

iperf Done.
```

**Comment by Orvaxis** [comment]
It seems I can't reproduce the issue anymore. Yesterday, I attempted a packet capture and found that packets suddenly stopped being sent. Capturing packets on the iperf3 server side also suggested that the server itself was the one that stopped sending traffic. However, I haven't been able to reproduce it today.

**Comment by Orvaxis** [comment]
I think I've pinpointed the issue. It stems from this piece of code: releasing the lock immediately after retrieving the state. The main loop thread might concurrently receive an ACK and issue a notification/signal (wake-up call), causing both sides to enter a waiting state. The write operation needs the main loop to wake it up, while this side needs to receive the ACK, but is currently unable to send data.
```rust
        let (state, send_window, is_full) = {
            let tcb = self.tcb.lock().unwrap();
            let state = tcb.get_state();
            (state, tcb.get_send_window(), tcb.is_send_buffer_full())
        };

        if state == TcpState::Closed {
            self.shutdown.lock().unwrap().ready();
            self.read_notify.lock().unwrap().take().map(|w| w.wake_by_ref()).unwrap_or(());
            return Poll::Ready(Err(std::io::Error::new(BrokenPipe, "TCP connection closed")));
        }

        if send_window == 0 || is_full {
            self.write_notify.lock().unwrap().replace(cx.waker().clone());
            let info = format!("current send window: {send_window}, send buffer full: {is_full}");
            log::trace!("{nt} {state:?}: [poll_write] {info}, waiting for the other side to send ACK...");
            return Poll::Pending;
        }
```
```log
535189	2.567320	10.3.0.1	10.3.0.33	TCP	4004	5201 → 63825 [PSH, ACK] Seq=1707048117 Ack=38 Win=524280 Len=3960
535190	2.567321	10.3.0.1	10.3.0.33	TCP	4004	5201 → 63825 [PSH, ACK] Seq=1707052077 Ack=38 Win=524280 Len=3960
535191	2.567327	10.3.0.33	10.3.0.1	TCP	44	63825 → 5201 [ACK] Seq=38 Ack=1707007429 Win=4194240 Len=0
535192	2.567348	10.3.0.1	10.3.0.33	TCP	4004	5201 → 63825 [PSH, ACK] Seq=1707056037 Ack=38 Win=524280 Len=3960
535193	2.567348	10.3.0.33	10.3.0.1	TCP	44	63825 → 5201 [ACK] Seq=38 Ack=1707056037 Win=4194240 Len=0
535194	2.567350	10.3.0.1	10.3.0.33	TCP	4004	5201 → 63825 [PSH, ACK] Seq=1707059997 Ack=38 Win=524280 Len=3960
535195	2.567351	10.3.0.1	10.3.0.33	TCP	4004	5201 → 63825 [PSH, ACK] Seq=1707063957 Ack=38 Win=524280 Len=3960
535196	2.567351	10.3.0.1	10.3.0.33	TCP	4004	5201 → 63825 [PSH, ACK] Seq=1707067917 Ack=38 Win=524280 Len=3960
535197	2.567352	10.3.0.1	10.3.0.33	TCP	1132	5201 → 63825 [PSH, ACK] Seq=1707071877 Ack=38 Win=524280 Len=1088
535198	2.567363	10.3.0.33	10.3.0.1	TCP	44	63825 → 5201 [ACK] Seq=38 Ack=1707072965 Win=4194240 Len=0
535199	10.009918	10.3.0.33	10.3.0.1	iPerf3	45	63823 → 5201 TEST_END(4)
535200	10.010884	10.3.0.1	10.3.0.33	TCP	44	5201 → 63823 [ACK] Seq=5 Ack=160 Win=524280 Len=0
535201	10.011221	10.3.0.1	10.3.0.33	iPerf3	45	5201 → 63823 EXCHANGE_RESULTS(13)
535202	10.011257	10.3.0.33	10.3.0.1	TCP	44	63823 → 5201 [ACK] Seq=160 Ack=6 Win=262144 Len=0
535203	10.011351	10.3.0.33	10.3.0.1	iPerf3	48	63823 → 5201 Next message is JSON of this length: 265
```

I added a log. When the problem occurred, inflight was 0, but the subsequent trigger sent buffer is full.
```rust
        self.inflight_packets.retain(|_, p| ack < p.seq + p.payload.len() as u32);

        log::info!("Updated inflight packets after ACK: {}", self.inflight_packets.len());
...


    self.write_notify.lock().unwrap().replace(cx.waker().clone());
            let info = format!("current send window: {send_window}, send buffer full: {is_full}");
            log::trace!("{nt} {state:?}: [poll_write] {info}, waiting for the other side to send ACK...");
            // 添加日志：明确Pending原因
            log::warn!("{nt} {state:?}: [poll_write] buffer full, returning Pending - potential deadlock if no ACK received");
            return Poll::Pending;
```
```log
[2025-10-12T14:07:22Z INFO  ipstack::stream::tcb] Updated inflight packets after ACK: 1
[2025-10-12T14:07:22Z WARN  ipstack::stream::tcp] TCP 10.3.0.33:60975 -> 10.3.0.1:5201 Established: [poll_write] buffer full, returning Pending - potential deadlock if no ACK received
[2025-10-12T14:07:22Z INFO  ipstack::stream::tcb] Updated inflight packets after ACK: 0
[2025-10-12T14:07:22Z INFO  tun] b_to_a poll_copy
[2025-10-12T14:07:22Z INFO  ipstack::stream::tcb] Updated inflight packets after ACK: 9
[2025-10-12T14:07:22Z INFO  ipstack::stream::tcb] Updated inflight packets after ACK: 9
[2025-10-12T14:07:22Z INFO  ipstack::stream::tcb] Updated inflight packets after ACK: 0
[2025-10-12T14:07:22Z WARN  ipstack::stream::tcp] TCP 10.3.0.33:60975 -> 10.3.0.1:5201 Established: [poll_write] buffer full, returning Pending - potential deadlock if no ACK received
[2025-10-12T14:07:23Z INFO  ipstack] PacketCounter up_pkt_sender rate: 64431/s, total: 5390292
[2025-10-12T14:07:23Z INFO  ipstack] PacketCounter up_pkt_receiver rate: 64436/s, total: 5390292
```
